[
  {
    "id": "who-uhc-2023",
    "problem_id": "public-health/health-insurance-coverage-global",
    "claim": "WHO reports that over 1 billion people experience catastrophic health expenditure annually, with 90 percent in LMICs where health-insurance coverage is below 30 percent.",
    "evidence_type": "primary-source",
    "source": {
      "title": "Tracking Universal Health Coverage: 2023 Global Monitoring Report",
      "url": "https://www.who.int/publications/i/item/9789240080374"
    },
    "source_date": "2023-09-18",
    "access_date": "2026-06-07",
    "method": "Reviewed WHO UHC monitoring report, financial-protection indicators, and insurance-coverage data.",
    "limitations": [
      "Insurance-coverage data depends on household surveys.",
      "Financial-protection measures vary by methodology."
    ],
    "confidence": "high"
  }
]
