[
  {
    "id": "who-world-report-vision-2019",
    "problem_id": "public-health/blindness-vision-impairment-global",
    "claim": "WHO World Report on Vision estimates 2.2 billion people with vision impairment, 1 billion preventable or unaddressed, cataract causing 50 percent of blindness in LMICs, and CSC below 50 percent in most low-income countries.",
    "evidence_type": "primary-source",
    "source": {
      "title": "World Report on Vision",
      "url": "https://www.who.int/publications/i/item/9789241516570"
    },
    "source_date": "2019-10-08",
    "access_date": "2026-06-07",
    "method": "Reviewed WHO vision report chapters on burden, cataract, CSC, and workforce.",
    "limitations": [
      "Vision-impairment estimates modeled from surveys of variable recency.",
      "CSC estimates depend on RAAB surveys which are infrequent."
    ],
    "confidence": "high"
  }
]
