[
  {
    "id": "who-hrh-strategy-2030-2022",
    "problem_id": "public-health/health-workforce-density-global",
    "claim": "WHO Working for Health 2022 projects 10 million health worker shortage by 2030, with 80 countries below 4.45 per 1000 density, concentrated in Sub-Saharan Africa and South Asia.",
    "evidence_type": "primary-source",
    "source": {
      "title": "Working for Health 2022-2030 Action Plan",
      "url": "https://www.who.int/publications/i/item/9789240063341"
    },
    "source_date": "2022-05-23",
    "access_date": "2026-06-07",
    "method": "Reviewed WHO HRH report, shortage projections, and density estimates.",
    "limitations": [
      "Shortage projections depend on demand-modeling assumptions.",
      "Sub-national distribution data is sparse."
    ],
    "confidence": "high"
  }
]
