[
  {
    "id": "who-drowning-global-report-2023",
    "problem_id": "public-health/drowning-prevention-south-asia",
    "claim": "WHO estimates 236000 drowning deaths globally in 2019, children under five at highest risk, over 90 percent in LMICs, with South Asia having the highest absolute numbers.",
    "evidence_type": "primary-source",
    "source": {
      "title": "Global Report on Drowning Prevention",
      "url": "https://www.who.int/publications/i/item/9789241565431"
    },
    "source_date": "2023-07-25",
    "access_date": "2026-06-07",
    "method": "Reviewed WHO drowning report, mortality data, and prevention recommendations.",
    "limitations": [
      "Mortality data depends on verbal autopsy in areas with incomplete vital registration.",
      "Drowning deaths are undercounted in many LMICs."
    ],
    "confidence": "high"
  },
  {
    "id": "rahman-anchal-drowning-bangladesh-2019",
    "problem_id": "public-health/drowning-prevention-south-asia",
    "claim": "A 2019 study found that community creche programs in Bangladesh reduced child drowning by over 80 percent through supervised childcare during peak-risk hours, demonstrating prevention feasibility.",
    "evidence_type": "peer-reviewed-study",
    "source": {
      "title": "Effectiveness of a community-based child drowning prevention programme in rural Bangladesh",
      "url": "https://pubmed.ncbi.nlm.nih.gov/30678912/"
    },
    "source_date": "2019-01-24",
    "access_date": "2026-06-07",
    "method": "Reviewed intervention design, drowning-mortality comparison, and effectiveness estimates.",
    "limitations": [
      "Study conducted in specific rural Bangladesh context.",
      "Creche effectiveness depends on sustained community engagement."
    ],
    "confidence": "high"
  }
]
