[{"id":"who-tobacco-global-report-2024","problem_id":"public-health/tobacco-control-taxation-global","claim":"WHO reports 8 million annual tobacco deaths, 80 percent in LMICs. Only 41 countries have tobacco taxes above 75 percent of retail price. Taxation is the single most effective control measure.","evidence_type":"primary-source","source":{"title":"WHO Report on the Global Tobacco Epidemic 2024","url":"https://www.who.int/news-room/fact-sheets/detail/tobacco"},"source_date":"2024-07-31","access_date":"2026-06-07","method":"Reviewed MPOWER tracking, tax-policy analysis, and country profiles.","limitations":["Tax-policy reporting is self-reported by countries.","Illicit-trade estimates are uncertain."],"confidence":"high"}]