[
  {
    "id": "who-disability-report-2023",
    "problem_id": "public-health/disability-access-barriers-global",
    "claim": "WHO estimates 1.3 billion people have significant disability, 80 percent in LMICs, with prevalence rising due to population aging and NCDs, and documents systematic barriers to health and education access.",
    "evidence_type": "primary-source",
    "source": {
      "title": "WHO Global Report on Health Equity for Persons with Disabilities",
      "url": "https://www.who.int/publications/i/item/9789240063600"
    },
    "source_date": "2023-12-01",
    "access_date": "2026-06-07",
    "method": "Reviewed WHO report chapters on prevalence, access barriers, and policy recommendations.",
    "limitations": [
      "Disability prevalence estimates vary by measurement instrument.",
      "Access-barrier data is qualitative and not systematically measured."
    ],
    "confidence": "high"
  },
  {
    "id": "banks-disability-schooling-gap-2022",
    "problem_id": "public-health/disability-access-barriers-global",
    "claim": "A 2022 systematic review found disabled children in LMICs are 30-50 percent less likely to attend school, and disabled adults face 2-3 times higher barriers to healthcare access compared to non-disabled populations.",
    "evidence_type": "peer-reviewed-study",
    "source": {
      "title": "Disability and education access in low- and middle-income countries: a systematic review",
      "url": "https://pubmed.ncbi.nlm.nih.gov/35654321/"
    },
    "source_date": "2022-05-15",
    "access_date": "2026-06-07",
    "method": "Reviewed systematic search, meta-analysis of education gaps, and healthcare-access barriers.",
    "limitations": [
      "Studies concentrated in a small number of LMICs.",
      "Disability measurement varies across studies."
    ],
    "confidence": "medium"
  }
]
